Park, Url
Acadia National Park, https://www.instagram.com/explore/locations/255532544/acadia-national-park/
American Samoa National Park,https://www.instagram.com/explore/locations/269431450/national-park-of-american-samoa/
Arches National Park, https://www.instagram.com/explore/locations/10324/arches-national-park/
Badlands National Park, https://www.instagram.com/explore/locations/7744751/badlands-national-park/
Big Bend National Park, https://www.instagram.com/explore/locations/249498236/big-bend-national-park/
Biscayne National Park, https://www.instagram.com/explore/locations/966506/biscayne-national-park/
Black Canyon of the Gunnison National Park, https://www.instagram.com/explore/locations/214133725/black-canyon-of-the-gunnison-national-park/
Bryce Canyon National Park, https://www.instagram.com/explore/locations/1015618315/bryce-canyon-national-park/
Canyonlands National Park, https://www.instagram.com/explore/locations/224373191/canyonlands-national-park/
Capitol Reef National Park, https://www.instagram.com/explore/locations/234532950/capitol-reef-national-park/
Carlsbad Caverns National Park, https://www.instagram.com/explore/locations/788533/carlsbad-caverns-national-park/
Channel Islands National Park, https://www.instagram.com/explore/locations/216749011/channel-islands-national-park/
Congaree National Park, https://www.instagram.com/explore/locations/228762893/congaree-national-park/
Crater Lake National Park, https://www.instagram.com/explore/locations/227555470/crater-lake-national-park/
Cuyahoga Valley National Park, https://www.instagram.com/explore/locations/223661289/cuyahoga-valley-national-park/
Death Valley National Park, https://www.instagram.com/explore/locations/215884232/death-valley-national-park/
Denali National Park, https://www.instagram.com/explore/locations/464265200586896/denali-national-park/
Dry Tortugas National Park, https://www.instagram.com/explore/locations/504923525/dry-tortugas-national-park/
Everglades National Park, https://www.instagram.com/explore/locations/217032321/everglades-national-park/
Gates of the Arctic National Park, https://www.instagram.com/explore/locations/584150537/gates-of-the-arctic-national-park/
Gateway Arch National Park, https://www.instagram.com/explore/locations/213535969/gateway-arch-national-park/
Glacier National Park, https://www.instagram.com/explore/locations/213692596/glacier-national-park/
Glacier Bay National Park, https://www.instagram.com/explore/locations/1872560099624305/glacier-bay-national-park/
Grand Canyon National Park, https://www.instagram.com/explore/locations/211064064/grand-canyon-national-park/
Grand Teton National Park, https://www.instagram.com/explore/locations/213877293/grand-teton-national-park/
Great Basin National Park, https://www.instagram.com/explore/locations/240304659/great-basin-national-park/
Great Sand Dunes National Park, 
Great Smoky Mountains National Park, https://www.instagram.com/explore/locations/330936715/great-smoky-mountains-national-park/
Guadalupe Mountains National Park, 
Haleakal National Park, https://www.instagram.com/explore/locations/213643536/haleakala-national-park/
Hawaii Volcanoes National Park, 
Hot Springs National Park, https://www.instagram.com/explore/locations/219504523/hot-springs-national-park/
Isle Royale National Park, https://www.instagram.com/explore/locations/21602075/isle-royale-national-park/
Joshua Tree National Park, https://www.instagram.com/explore/locations/212930591/joshua-tree-national-park/
Katmai National Park, 
Kenai Fjords National Park, https://www.instagram.com/explore/locations/4044899/kenai-fjords-national-park/
Kings Canyon National Park, https://www.instagram.com/explore/locations/5760888/kings-canyon-national-park/
Kobuk Valley National Park, https://www.instagram.com/explore/locations/687785309/kobuk-valley-national-park/
Lake Clark National Park, https://www.instagram.com/explore/locations/1693184004319261/lake-clark-national-park/
Lassen Volcanic National Park, https://www.instagram.com/explore/locations/239592455/lassen-volcanic-national-park/
Mammoth Cave National Park, https://www.instagram.com/explore/locations/1305215132928082/mammoth-cave-national-park/
Mesa Verde National Park, https://www.instagram.com/explore/locations/234408138/mesa-verde-national-park/
Mount Rainier National Park, https://www.instagram.com/explore/locations/304776852/mount-rainier-national-park/
North Cascades National Park, https://www.instagram.com/explore/locations/265143850/north-cascades-national-park/
Olympic National Park, https://www.instagram.com/explore/locations/216101491/olympic-national-park/
Petrified Forest National Park, https://www.instagram.com/explore/locations/97246906/petrified-forest-national-park/
Pinnacles National Park, https://www.instagram.com/explore/locations/360069556/pinnacles-national-park/
Redwood National Park, https://www.instagram.com/explore/locations/454213404933008/redwood-national-park/
Rocky Mountain National Park, https://www.instagram.com/explore/locations/215059060/rocky-mountain-national-park/
Saguaro National Park, https://www.instagram.com/explore/locations/1469025/saguaro-national-park/
Sequoia National Park, 
Shenandoah National Park, https://www.instagram.com/explore/locations/229869357/shenandoah-national-park/
Theodore Roosevelt National Park, https://www.instagram.com/explore/locations/410036096/theodore-roosevelt-national-park/
Virgin Islands National Park, https://www.instagram.com/explore/locations/258444097/virgin-islands-national-park/
Voyageurs National Park, https://www.instagram.com/explore/locations/236793342/voyageurs-national-park/
Wind Cave National Park, https://www.instagram.com/explore/locations/237407286/wind-cave-national-park/
WrangellSt.Elias National Park, 
Yellowstone National Park, https://www.instagram.com/explore/locations/215326153/yellowstone-national-park/
Yosemite National Park, https://www.instagram.com/explore/locations/213012122/yosemite-national-park/
Zion National Park, https://www.instagram.com/explore/locations/212934193/zion-national-park/
